{
  "work_item_id": "wi-watch-001",
  "source_provider": "anthropic",
  "source_external_id": "feature-2026-04-watchlist",
  "title": "Speculative multi-repo assistant orchestration",
  "state": "WATCHLISTED",
  "risk_score": 35,
  "execution_lane": null,
  "policy_decision_id": "policy-watch-001",
  "current_artifact_id": "policy-watch-001",
  "attempt_count": 0,
  "dead_letter_reason": null,
  "created_at": "2026-04-22T12:00:00Z",
  "updated_at": "2026-04-22T13:00:00Z"
}
