{
  "work_item_id": "wi-fast-001",
  "source_provider": "anthropic",
  "source_external_id": "feature-2026-04-fast",
  "title": "Support response format tool mode",
  "state": "PR_MERGEABLE",
  "risk_score": 25,
  "execution_lane": "fast",
  "policy_decision_id": "policy-fast-001",
  "current_artifact_id": "pr-fast-001",
  "attempt_count": 1,
  "dead_letter_reason": null,
  "created_at": "2026-04-22T12:00:00Z",
  "updated_at": "2026-04-22T18:00:00Z"
}
