{
  "work_item_id": "wi-backlog-001",
  "source_provider": "anthropic",
  "source_external_id": "feature-2026-04-backlog",
  "title": "Customer-facing configurable citation formatting",
  "state": "POLICY_ASSIGNED",
  "risk_score": 35,
  "execution_lane": "guarded",
  "policy_decision_id": "policy-backlog-001",
  "current_artifact_id": "policy-backlog-001",
  "attempt_count": 0,
  "dead_letter_reason": null,
  "created_at": "2026-04-22T12:00:00Z",
  "updated_at": "2026-04-22T12:55:00Z"
}
